,tweet_id,text,rating_numerator,rating_denominator,name,date,time,dog_type,jpg_url,p1_conf,p2_conf,p3_conf,dog_breed,retweet_count,favorite_count
424,800141422401830912,This is Peaches. She's the ultimate selfie sidekick. Super sneaky tongue slip appreciated. 13/10 https://t.co/pbKOesr8Tg,13,10,Peaches,2016-11-20,00:59:15,,https://pbs.twimg.com/media/CxqsX-8XUAAEvjD.jpg,0.938048,0.0251195,0.0229773,Golden_retriever,2383,14467
425,800018252395122689,Here's a doggo doin a struggle. 11/10 much determined https://t.co/gQqRBfkX4I,11,10,None,2016-11-19,16:49:49,doggo,https://pbs.twimg.com/ext_tw_video_thumb/800018199223959552/pu/img/3Qp73edtkZO-qWPy.jpg,0.289485,0.2432969999999999,0.14363,,12254,26805
426,799757965289017345,This is Sobe. She's a h*ckin happy doggo. Only one leg tho. Must have good balance. 13/10 would smile back https://t.co/OiH8PaOxB1,13,10,Sobe,2016-11-18,23:35:32,doggo,https://pbs.twimg.com/media/CxlPnoSUcAEXf1i.jpg,0.442534,0.288684,0.196399,Border_collie,1997,7946
427,799422933579902976,This is Longfellow (prolly sophisticated). He's a North Appalachian Oatzenjammer. Concerned about wrinkled feets. 12/10 would hug softly https://t.co/bpLuQuxzHZ,12,10,Longfellow,2016-11-18,01:24:14,,https://pbs.twimg.com/media/Cxge6AdUQAAvXLB.jpg,0.58363,0.276095,0.0185500999999999,Miniature_pinscher,1792,7669
428,799297110730567681,This is Jeffrey. He's quite the jokester. Takes it too far sometimes. Still 11/10 would pet https://t.co/YDtZcAiMAf,11,10,Jeffrey,2016-11-17,17:04:16,,https://pbs.twimg.com/media/CxeseRgUoAM_SQK.jpg,0.985028,0.00583442,0.00544281,Malamute,2549,9358
429,799063482566066176,This is Mister. He only wears the most fashionable af headwear. 11/10 h*ckin stylish https://t.co/BXJFKOVnJm,11,10,Mister,2016-11-17,01:35:54,,https://pbs.twimg.com/media/CxbX_n2WIAAHaLS.jpg,0.334436,0.231573,0.214203,Norfolk_terrier,2333,7673
430,798933969379225600,This is Iroh. He's in a predicament. 12/10 someone help him https://t.co/KJAKO2kXsL,12,10,Iroh,2016-11-16,17:01:16,,https://pbs.twimg.com/media/CxZiLcLXUAApMVy.jpg,0.703224,0.229351,0.0443508,Siberian_husky,4139,12380
431,798925684722855936,This is Shadow. He's a firm believer that they're all good dogs. H*ckin passionate about it too. 11/10 I stand with Shadow https://t.co/8yvpacwBcu,11,10,Shadow,2016-11-16,16:28:21,,https://pbs.twimg.com/media/CxZaqh_WQAA7lY3.jpg,0.539463,0.184897,0.163024,West_highland_white_terrier,1355,7145
432,798209839306514432,This is Cooper. His bow tie was too heavy for the front so he moved it to the side. Balanced af now. 13/10 https://t.co/jG1PAFkB81,13,10,Cooper,2016-11-14,17:03:50,,https://pbs.twimg.com/media/CxPPnCYWIAAo_ao.jpg,0.524583,0.102931,0.0978931,Pekinese,2418,9892
433,797971864723324932,Here's a helicopter pupper. He takes off at random. H*ckin hard to control. 12/10 rare af https://t.co/GRWPgNKt2z,12,10,None,2016-11-14,01:18:12,pupper,https://pbs.twimg.com/media/CxL3IWeVEAAAIE2.jpg,0.489845,0.30576,0.0727991,American_staffordshire_terrier,2881,10918
434,797545162159308800,This is Cassie. She steals things. Guilt increases slightly each time. 12/10 would forgive almost immediately https://t.co/Ia19irLwyB,12,10,Cassie,2016-11-12,21:02:38,,https://pbs.twimg.com/media/CxFzFAAUAAA5C9z.jpg,0.954089,0.0336439,0.00973566,Pembroke,4601,13830
435,797236660651966464,This is Pancake. She loves Batman and winks like a h*ckin champ. 12/10 real crowd pleaser https://t.co/6kqsAjJNhi,12,10,Pancake,2016-11-12,00:36:46,,https://pbs.twimg.com/media/CxBafisWQAAtJ1X.jpg,0.767005,0.100844,0.0483681,Collie,6128,18865
436,796865951799083009,This is Tyr. He's just checking on you. Nifty af tongue slip. 12/10 would absolutely pet https://t.co/Jgnuiyvq06,12,10,Tyr,2016-11-11,00:03:42,,https://pbs.twimg.com/media/Cw8JWZ2UsAAJOZ6.jpg,0.8391290000000001,0.0806985,0.034505,Cardigan,1825,7283
437,796759840936919040,Say hello to Romeo. He was just told that it's too cold for the pool. H*ckin nonsense. 11/10 would help fill up https://t.co/6hx7ur6sNI,11,10,Romeo,2016-11-10,17:02:03,,https://pbs.twimg.com/media/Cw6o1JQXcAAtP78.jpg,0.463996,0.155566,0.137587,American_staffordshire_terrier,2819,11170
438,796484825502875648,Here's a sleepy doggo that requested some assistance. 12/10 would carry everywhere https://t.co/bvkkqOjNDV,12,10,None,2016-11-09,22:49:15,doggo,https://pbs.twimg.com/media/Cw2uty8VQAAB0pL.jpg,0.116924,0.107511,0.0998434,Cocker_spaniel,1644,7164
439,796387464403357696,This is Snicku. He's having trouble reading because he's a dog. Glasses only helped a little. Nap preferred. 12/10 would snug well https://t.co/cVLUasbKA5,12,10,Snicku,2016-11-09,16:22:22,,https://pbs.twimg.com/media/Cw1WKu1UQAAvWsu.jpg,0.461164,0.28865,0.052423,Pekinese,3875,10421
440,796149749086875649,This is Ruby. She just turned on the news. Officially terrified. 11/10 deep breaths Ruby https://t.co/y5KarNXWXt,11,10,Ruby,2016-11-09,00:37:46,,https://pbs.twimg.com/media/Cwx99rpW8AMk_Ie.jpg,0.600276,0.140798,0.0873548,Golden_retriever,13316,30392
441,796116448414461957,I didn't believe it at first but now I can see that voter fraud is a serious h*ckin issue. 11/10 https://t.co/7i0bDMbrVN,11,10,None,2016-11-08,22:25:27,,https://pbs.twimg.com/media/CwxfrguUUAA1cbl.jpg,0.700182,0.260738,0.0171099,Cardigan,2243,8612
442,796080075804475393,This is Yogi. He's 98% floof. Snuggable af. 12/10 https://t.co/opoXKxmfFm,12,10,Yogi,2016-11-08,20:00:55,,https://pbs.twimg.com/media/Cww-msrXcAAxm3K.jpg,0.973846,0.0141098999999999,0.00235832,Chow,2158,7996
443,796031486298386433,This is Daisy. She's here to make your day better. 13/10 mission h*ckin successful https://t.co/PbgvuD0qIL,13,10,Daisy,2016-11-08,16:47:50,,https://pbs.twimg.com/media/CwwSaWJWIAASuoY.jpg,0.893775,0.0701398,0.00841853,Golden_retriever,3489,10233
444,795464331001561088,Elder doggo does a splash. Both 13/10 incredible stuff https://t.co/gBUDjdEcqz,13,10,None,2016-11-07,03:14:10,doggo,https://pbs.twimg.com/ext_tw_video_thumb/795464066940764160/pu/img/jPkMMQXdydb7CqFX.jpg,0.193082,0.157927,0.1246839999999999,Golden_retriever,21866,46605
445,795400264262053889,This is Brody. He's trying to make the same face as the football. 12/10 https://t.co/2H4MfOGlpQ,12,10,Brody,2016-11-06,22:59:35,,https://pbs.twimg.com/media/CwnUUGTWIAE8sFR.jpg,0.925494,0.0592408,0.00449534,Golden_retriever,2672,9471
446,795076730285391872,This is Bailey. She loves going down slides but is very bad at it. Still 11/10 https://t.co/ivPWhspN3E,11,10,Bailey,2016-11-06,01:33:58,,https://pbs.twimg.com/media/CwiuEJmW8AAZnit.jpg,0.676439,0.0499953,0.0446596,,5078,15297
447,794926597468000259,This is Mack. He's rather h*ckin sleepy. Exceptional ears. 12/10 would boop https://t.co/XRPvTPF0VH,12,10,Mack,2016-11-05,15:37:24,,https://pbs.twimg.com/media/CwglhZVXgAAc3_w.jpg,0.569566,0.173745,0.0376618,Toy_poodle,2152,9647
448,794332329137291264,This is Nimbus (like the cloud). He just bought this fancy af duck raincoat. Only protects one ear tho. 12/10 so h*ckin floofy https://t.co/SIQbb8c3AU,12,10,Nimbus,2016-11-04,00:15:59,,https://pbs.twimg.com/media/CwYJBiHXgAQlvrh.jpg,0.988307,0.00490635,0.00290129,Samoyed,2530,9103
449,794205286408003585,This is Laika. She was a space pupper. The first space pupper actually. Orbited earth like a h*ckin boss. 14/10 hero af https://t.co/trSjgY3h4g,14,10,Laika,2016-11-03,15:51:10,pupper,https://pbs.twimg.com/media/CwWVe_3WEAAHAvx.jpg,0.66266,0.294827,0.0203711,,3102,8746
450,793962221541933056,This is Maximus. His face is stuck like that. Tragic really. Great tongue tho. 12/10 would pet firmly https://t.co/xIfrsMNLBR,12,10,Maximus,2016-11-02,23:45:19,,https://pbs.twimg.com/media/CwS4aqZXUAAe3IO.jpg,0.8616510000000001,0.0444618,0.0164967,Labrador_retriever,4557,15856
451,793845145112371200,This is Clark. He was just caught wearing pants. 13/10 game-changing af https://t.co/2Xo19aPrG5,13,10,Clark,2016-11-02,16:00:06,,https://pbs.twimg.com/media/CwRN8H6WgAASe4X.jpg,0.7652770000000001,0.1127529999999999,0.0476616999999999,Old_english_sheepdog,1739,8738
452,793601777308463104,This is Dobby. I can't stop looking at her feet. 12/10 would absolutely snug https://t.co/LhzPWv6rTv,12,10,Dobby,2016-11-01,23:53:02,,https://pbs.twimg.com/media/CwNwmxvXEAEJ54Z.jpg,0.538981,0.21783,0.0891487,Miniature_pinscher,1510,7559
453,793500921481273345,This is Fiona. She's an extremely mediocre copilot. Very distracting. Wink makes up for all the missed turns. 12/10 https://t.co/aF5MmpvPqN,12,10,Fiona,2016-11-01,17:12:16,,https://pbs.twimg.com/media/CwMU34YWIAAz1nU.jpg,0.3261219999999999,0.219904,0.163366,Golden_retriever,2222,10088
454,793286476301799424,This is Moreton. He's the Good Boy Who Lived. 13/10 magical as h*ck https://t.co/rLHGx3VAF3,13,10,Moreton,2016-11-01,03:00:09,,https://pbs.twimg.com/media/CwJR1okWIAA6XMp.jpg,0.2746369999999999,0.142204,0.109677,Afghan_hound,8563,23282
455,793271401113350145,Meet Dave. It's his favorite day of the year. He gets to fulfill his dream of being a dinosaur. 12/10 inspirational af https://t.co/MgQSdfZGPN,12,10,Dave,2016-11-01,02:00:14,,https://pbs.twimg.com/media/CwJEIKTWYAAvL-T.jpg,0.2316949999999999,0.206749,0.0701195,Siberian_husky,2236,8230
456,793256262322548741,Oh h*ck look at this spookling right here. Fright level off the charts. 12/10 sufficiently spooked https://t.co/BNy9IIJMb0,12,10,None,2016-11-01,01:00:05,,https://pbs.twimg.com/media/CwI2XCvXEAEO8mc.jpg,0.2076219999999999,0.0605741999999999,0.0412205,Basset,7768,18868
457,793241302385262592,This is Tucker. He's out here bustin h*ckin ghosts. 13/10 dedicated af https://t.co/Ap477GhwXt,13,10,Tucker,2016-11-01,00:00:38,,https://pbs.twimg.com/media/CwIougTWcAAMLyq.jpg,0.559308,0.3902219999999999,0.0363157,Golden_retriever,3061,9952
458,793226087023144960,"This is Juno. She spooked me up real good, but only to get my attention. Above average handwriting for a dog I think. 11/10 https://t.co/hFxxBCWlwj",11,10,Juno,2016-10-31,23:00:11,,https://pbs.twimg.com/media/CwIa5CjW8AErZgL.jpg,0.456047,0.273428,0.0836433,Wire-haired_fox_terrier,2704,9252
459,793210959003287553,This is Maude. She's the h*ckin happiest wasp you've ever seen. 10/10 would pet with caution https://t.co/etL8FHBrh8,10,10,Maude,2016-10-31,22:00:04,,https://pbs.twimg.com/media/CwINKJeW8AYHVkn.jpg,0.874431,0.0187590999999999,0.0151344,French_bulldog,2599,8448
460,793195938047070209,Say hello to Lily. She's pupset that her costume doesn't fit as well as last year. 12/10 poor puppo https://t.co/YSi6K1firY,12,10,Lily,2016-10-31,21:00:23,puppo,https://pbs.twimg.com/media/CwH_foYWgAEvTyI.jpg,0.654762,0.0741,0.0423393,Labrador_retriever,5254,14398
461,793180763617361921,This is Newt. He's a strawberry. 11/10 https://t.co/2VhmlwxA1Q,11,10,Newt,2016-10-31,20:00:05,,https://pbs.twimg.com/media/CwHxsdYVMAAqGCJ.jpg,0.266824,0.218783,0.13296,Lakeland_terrier,1857,6541
462,793165685325201412,This is Benji. He's Air Bud. It's a low effort costume but he pulls it off rather h*ckin well. 12/10 would happily get dunked on https://t.co/IbzT7DJvBo,12,10,Benji,2016-10-31,19:00:10,,https://pbs.twimg.com/media/CwHj-jGWAAAnsny.jpg,0.946224,0.0364766,0.00235285,Golden_retriever,2618,8874
463,793150605191548928,This is Nida. She's a free elf. Waited so long for this day. 11/10 https://t.co/3lE8Izgmkf,11,10,Nida,2016-10-31,18:00:14,,https://pbs.twimg.com/media/CwHWOZ7W8AAHv8S.jpg,0.193869,0.16038,0.1259819999999999,Italian_greyhound,1591,5830
464,793135492858580992,Your favorite squad is looking extra h*ckin spooky today. 13/10 for all https://t.co/PrgvOyPtDT,13,10,None,2016-10-31,17:00:11,,https://pbs.twimg.com/media/CwHIg61WIAApnEV.jpg,0.737041,0.0523959,0.0465926,,2347,6055
465,793120401413079041,"This is Robin. She's desperately trying to do me a frighten, but her tongue drastically decreases her spook value. Still 11/10 great effort https://t.co/sxMrsOZ8zb",11,10,Robin,2016-10-31,16:00:13,,https://pbs.twimg.com/media/CwG6zDfWcAA8jBD.jpg,0.7249439999999999,0.169744,0.0355023,Labrador_retriever,3665,11982
466,792913359805018113,Here is a perfect example of someone who has their priorities in order. 13/10 for both owner and Forrest https://t.co/LRyMrU7Wfq,13,10,a,2016-10-31,02:17:31,,https://pbs.twimg.com/media/CwD-eCLWIAA6v0B.jpg,0.2267159999999999,0.0819414,0.0390086,,3697,13536
467,792883833364439040,This is Bailey. She's rather h*ckin hype for Halloween tomorrow. Carved those pupkins herself. 12/10 https://t.co/v17mFm0Ftz,12,10,Bailey,2016-10-31,00:20:11,,https://pbs.twimg.com/media/CwDjoH3WAAIniIs.jpg,0.999306,0.000113129,8.31451e-05,Standard_poodle,3990,10677
468,792773781206999040,This is Monster. Not an actual monster tho. He's showing you his tongue. Very impressive Monster. 12/10 would snug https://t.co/RhaPExuxJL,12,10,Monster,2016-10-30,17:02:53,,https://pbs.twimg.com/media/CwB_i-zXEAEiP29.jpg,0.912804,0.0678225,0.00445069,Yorkshire_terrier,1566,6980
469,792394556390137856,Meet BeBe. She rocks the messy bun of your dreams. H*ckin flawless. 12/10 would watch her tutorial https://t.co/of0pFNBIl8,12,10,BeBe,2016-10-29,15:55:58,,https://pbs.twimg.com/media/Cv8moW9W8AIHOxR.jpg,0.746387,0.0916151,0.0610781999999999,Cocker_spaniel,4000,12673
470,792050063153438720,This is Remus. He's a mop that came to life. Can't see anything. Constantly trips over himself. Still a very good dog. 11/10 https://t.co/S3f1SYylzu,11,10,Remus,2016-10-28,17:07:05,,https://pbs.twimg.com/media/Cv3tU38WcAASFas.jpg,0.942856,0.0527151999999999,0.0027429999999999,Komondor,1663,6759
471,791672322847637504,When she says you're a good boy and you know you're a good boy because you're a good boy. 13/10 https://t.co/O5IUmRHRIh,13,10,None,2016-10-27,16:06:04,,https://pbs.twimg.com/media/CvyVxQRWEAAdSZS.jpg,0.705092,0.219721,0.015965,Golden_retriever,2916,11113
472,791406955684368384,Say hello to Levi. He's a Madagascan Butterbop. One of the more docile Butterbops I've seen. 12/10 would give all the pets https://t.co/Zcw9Sccctc,12,10,Levi,2016-10-26,22:31:36,,https://pbs.twimg.com/media/CvukbEkWAAAV-69.jpg,0.972629,0.0270259,0.000152502,Pembroke,3840,12455
473,791312159183634433,This is Mabel. She's super h*ckin smol. Portable af. Comes with the smol shoe. 12/10 would keep in frocket https://t.co/GGJvxYt3xK,12,10,Mabel,2016-10-26,16:14:55,,https://pbs.twimg.com/media/CvtONV4WAAAQ3Rn.jpg,0.892925,0.0955238,0.00354426,Miniature_pinscher,2356,8297
474,790987426131050500,This is Misty. She has a cowboy hat on her nose. 12/10 https://t.co/Eno0mypHIr,12,10,Misty,2016-10-25,18:44:32,,https://pbs.twimg.com/media/Cvom3ZJXEAE29TD.jpg,0.349195,0.309535,0.104768,Cocker_spaniel,1981,9278
475,790946055508652032,This is Betty. She's assisting with the dishes. Such a good puppo. 12/10 h*ckin helpful af https://t.co/dgvTPZ9tgI,12,10,Betty,2016-10-25,16:00:09,puppo,https://pbs.twimg.com/media/CvoBPWRWgAA4het.jpg,0.700466,0.245773,0.0390116999999999,Golden_retriever,4371,15822
476,790698755171364864,This is Mosby. He appears to be rather h*ckin snuggable af. 12/10 keep it up Mosby https://t.co/IiiBq460I7,12,10,Mosby,2016-10-24,23:37:28,,https://pbs.twimg.com/media/CvkgUjbUsAEvo7l.jpg,0.996541,0.00105698,0.000997907,Bernese_mountain_dog,1796,7778
477,790581949425475584,This is Duke. He sneaks into the fridge sometimes. It's his safe place. 11/10 would give little jacket if necessary https://t.co/Fd5WFDTMH4,11,10,Duke,2016-10-24,15:53:19,,https://pbs.twimg.com/media/Cvi2FiKWgAAif1u.jpg,0.998886,0.000152999,0.000130817,Malinois,6616,19481
478,790337589677002753,Meet Maggie. She can hear your cells divide. 12/10 can also probably fly https://t.co/ovE2hqXryV,12,10,Maggie,2016-10-23,23:42:19,,https://pbs.twimg.com/media/CvfX2AnWYAAQTay.jpg,0.658808,0.153096,0.102299,Pembroke,1763,7405
479,790277117346975746,This is Bruce. He never backs down from a challenge. 11/10 you got this Bruce https://t.co/aI7umZHIq7,11,10,Bruce,2016-10-23,19:42:02,,https://pbs.twimg.com/media/Cveg1-NXgAASaaT.jpg,0.427742,0.190503,0.146427,Labrador_retriever,2944,11858
480,789986466051088384,This is Happy. He's a bathtub reviewer. Seems to be pleased with this one. 12/10 https://t.co/Ln89R4FP7v,12,10,Happy,2016-10-23,00:27:05,,https://pbs.twimg.com/media/CvaYgDOWgAEfjls.jpg,0.479477,0.325106,0.0785304999999999,Golden_retriever,2137,8779
481,789628658055020548,This is Eli. He can fly. 13/10 magical af https://t.co/huPSJJ7FDI,13,10,Eli,2016-10-22,00:45:17,,https://pbs.twimg.com/media/CvVTEnPXYAAWLyL.jpg,0.260702,0.0881427,0.0798831,Chow,1637,7058
482,789599242079838210,This is Brownie. She's wearing a Halloween themed onesie. 12/10 festive af https://t.co/0R4meWXFOx,12,10,Brownie,2016-10-21,22:48:24,,https://pbs.twimg.com/media/CvU4UZpXgAE1pAV.jpg,0.8788219999999999,0.0185703,0.0174985,Chesapeake_bay_retriever,1786,6358
483,789530877013393408,This is Rizzy. She smiles a lot. 12/10 contagious af https://t.co/TU4sZogVIq,12,10,Rizzy,2016-10-21,18:16:44,,https://pbs.twimg.com/media/CvT6IV6WEAQhhV5.jpg,0.363272,0.197021,0.151024,Schipperke,3144,11050
484,789268448748703744,This is Stella. She's happier than I will ever be. 10/10 would trade lives with https://t.co/JSs2bfDtTS,10,10,Stella,2016-10-21,00:53:56,,https://pbs.twimg.com/media/CvQLdotWcAAZn86.jpg,0.81286,0.120853,0.0242692999999999,Malamute,2434,8626
485,789137962068021249,This is Bo. He's a West Congolese Bugaboop Snuggle. Rather exotic. Master of the head tilt. 12/10 would pay to pet https://t.co/2jwxxtNzoN,12,10,Bo,2016-10-20,16:15:26,,https://pbs.twimg.com/media/CvOUw8vWYAAzJDq.jpg,0.746135,0.0703834,0.0492369,Chihuahua,2598,9200
486,788908386943430656,"This is Lucy. She destroyed not one, but two remotes trying to turn off the debate. 11/10 relatable af https://t.co/3BXh073tDm",11,10,Lucy,2016-10-20,01:03:11,,https://pbs.twimg.com/media/CvLD-mbWYAAFI8w.jpg,0.8815379999999999,0.0355131,0.0340897,Golden_retriever,11669,25987
487,788765914992902144,This is Butter. She can have whatever she wants forever. 12/10 would hug softly https://t.co/x5gXRS1abq,12,10,Butter,2016-10-19,15:37:03,,https://pbs.twimg.com/media/CvJCabcWgAIoUxW.jpg,0.500509,0.272734,0.0414758,Cocker_spaniel,9624,25824
488,788412144018661376,This is Dexter. He breaks hearts for a living. 11/10 h*ckin handsome af https://t.co/4DhSsC1W7S,11,10,Dexter,2016-10-18,16:11:17,,https://pbs.twimg.com/media/CvEAqQoWgAADj5K.jpg,0.805238,0.113798,0.0385587,Golden_retriever,4906,14666
489,788178268662984705,Atlas is back and this time he's got doggles. Still 13/10 solarly conscious af https://t.co/s7MgFWDySc,13,10,None,2016-10-18,00:41:57,,https://pbs.twimg.com/media/CvAr88kW8AEKNAO.jpg,0.73548,0.075101,0.0360719,Samoyed,1966,6872
490,788150585577050112,This is Leo. He's a golden chow. Rather h*ckin rare. 13/10 would give extra pats https://t.co/xosHjFzVXc,13,10,Leo,2016-10-17,22:51:57,,https://pbs.twimg.com/media/CvASw6dWcAQmo3X.jpg,0.814145,0.112704,0.0158832,Chow,1196,5778
491,788039637453406209,Did... did they pick out that license plate? 12/10 for both https://t.co/lRmUUOxgbQ,12,10,None,2016-10-17,15:31:05,,https://pbs.twimg.com/media/Cu-t20yWEAAFHXi.jpg,0.362925,0.304759,0.101702,,1218,5772
492,787810552592695296,This is Frank. He wears sunglasses and walks himself. 11/10 I'll never be this cool or independent https://t.co/pNNjBtHWPc,11,10,Frank,2016-10-17,00:20:47,,https://pbs.twimg.com/media/Cu7dg2RXYAIaGXE.jpg,0.362835,0.2218639999999999,0.0804183,Pug,2831,8123
493,787717603741622272,This is Tonks. She is a service puppo. Can hear a caterpillar hiccup from 7 miles away. 13/10 would follow anywhere https://t.co/i622ZbWkUp,13,10,Tonks,2016-10-16,18:11:26,puppo,https://pbs.twimg.com/media/Cu6I9vvWIAAZG0a.jpg,0.992339,0.00492039,0.0008528019999999,German_shepherd,2576,9687
494,787397959788929025,This is Moose. He's rather h*ckin dangerous (you can tell by the collar). 11/10 would still attempt to snug https://t.co/lHVHGdDzb3,11,10,Moose,2016-10-15,21:01:17,,https://pbs.twimg.com/media/Cu1mQsDWEAAU_VQ.jpg,0.900483,0.0210845,0.019484,Chihuahua,2653,10298
495,787322443945877504,This is Lincoln. He forgot to use his blinker when he changed lanes just now. Guilty as h*ck. Still 10/10 https://t.co/lsrR83SiVp,10,10,Lincoln,2016-10-15,16:01:13,,https://pbs.twimg.com/media/Cu0hlfwWYAEdnXO.jpg,0.747739,0.1057029999999999,0.0172568,Golden_retriever,1621,7369
496,786963064373534720,This is Rory. He's got an interview in a few minutes. Looking spiffy af. Nervous as h*ck tho. 12/10 would hire https://t.co/ibj5g6xaAj,12,10,Rory,2016-10-14,16:13:10,,https://pbs.twimg.com/media/Cuvau3MW8AAxaRv.jpg,0.915303,0.0462126,0.0375041,Golden_retriever,7403,25198
497,786709082849828864,"This is Logan, the Chow who lived. He solemnly swears he's up to lots of good. H*ckin magical af 9.75/10 https://t.co/yBO5wuqaPS",75,10,Logan,2016-10-13,23:23:56,,https://pbs.twimg.com/media/CurzvFTXgAA2_AP.jpg,0.467321,0.122978,0.102654,Pomeranian,5704,17318
498,786664955043049472,"""Honestly Kathleen I just want more Ken Bone"" 12/10 https://t.co/HmlEvAMP4r",12,10,None,2016-10-13,20:28:35,,https://pbs.twimg.com/media/CurLmoqXgAEPoJ-.jpg,0.512034,0.464816,0.00781249,Leonberg,2358,10017
499,786595970293370880,This is Dale. He's a real spookster. Did me quite the frighten. 11/10 not too spooky to pet tho https://t.co/L8BWDD4oBX,11,10,Dale,2016-10-13,15:54:28,,https://pbs.twimg.com/media/CuqM0fVWAAAboKR.jpg,0.709512,0.287178,0.000570176,Pembroke,2901,8953
500,786363235746385920,This is Rizzo. He has many talents. A true renaissance doggo. 13/10 entertaining af https://t.co/TVXpEJB7Wn,13,10,Rizzo,2016-10-13,00:29:39,doggo,https://pbs.twimg.com/media/Cum5LlfWAAAyPcS.jpg,0.929266,0.0628667,0.00215669,Golden_retriever,3204,10253
501,786233965241827333,This is Mattie. She's extremely dangerous. Will bite your h*ckin finger right off. Still 11/10 would pet with caution https://t.co/78c9W8kLFh,11,10,Mattie,2016-10-12,15:55:59,,https://pbs.twimg.com/media/CulDnZpWcAAGbZ-.jpg,0.478193,0.224817,0.0773956,Labrador_retriever,4352,14363
502,785927819176054784,This is Lucy. She's strives to be the best potato she can be. 12/10 would boop https://t.co/lntsj7Fc4Y,12,10,Lucy,2016-10-11,19:39:28,,https://pbs.twimg.com/media/CugtKeXWEAAamDZ.jpg,0.97207,0.00849262,0.00288271,Toy_poodle,2973,10769
503,785872687017132033,Meet Rusty. He appears to be rather h*ckin fluffy. Also downright adorable af. 12/10 would rub my face against his https://t.co/1j9kLGb4wV,12,10,Rusty,2016-10-11,16:00:24,,https://pbs.twimg.com/ext_tw_video_thumb/785872596088811520/pu/img/5O-_BgqdFQu_2Bt7.jpg,0.392108,0.198358,0.143328,Great_pyrenees,1667,6321
504,785639753186217984,This is Pinot. He's a sophisticated doggo. You can tell by the hat. Also pointier than your average pupper. Still 10/10 would pet cautiously https://t.co/f2wmLZTPHd,10,10,Pinot,2016-10-11,00:34:48,doggo,https://pbs.twimg.com/media/CucnLmeWAAALOSC.jpg,0.978042,0.0061063,0.00544197,,2098,7429
505,785533386513321988,This is Dallas. Her tongue is ridiculous. 11/10 h*ckin proud af https://t.co/h4jhlH4EyG,11,10,Dallas,2016-10-10,17:32:08,,https://pbs.twimg.com/media/CubGchjXEAA6gpw.jpg,0.4360229999999999,0.258049,0.145231,Miniature_pinscher,1831,8554
506,785264754247995392,This is Doc. He requested to be carried around like that. 12/10 anything for Doc https://t.co/mWYACm4qnx,12,10,Doc,2016-10-09,23:44:41,,https://pbs.twimg.com/media/CuXSHNnWcAIWEwn.jpg,0.6748930000000001,0.0567395999999999,0.056137,Chow,1511,6888
507,785170936622350336,This is Hero. He was enjoying the car ride until he remembered that bees are dying globally at an alarming rate. 11/10 https://t.co/cubFg7F4qQ,11,10,Hero,2016-10-09,17:31:53,,https://pbs.twimg.com/media/CuV8yfxXEAAUlye.jpg,0.891193,0.0274944,0.0195303,Eskimo_dog,4474,11328
508,784826020293709826,This is Rusty. He's going D1 for sure. Insane vertical. 13/10 would draft https://t.co/AsykOwMrXQ,13,10,Rusty,2016-10-08,18:41:19,,https://pbs.twimg.com/media/CuRDF-XWcAIZSer.jpg,0.0903414,0.0834988,0.0774556,Chow,2999,9548
509,784517518371221505,This is Frankie. He has yet to learn how to control his tongue. 11/10 maybe one day https://t.co/p6fgYe2dB6,11,10,Frankie,2016-10-07,22:15:26,,https://pbs.twimg.com/media/CuMqhGrXYAQwRqU.jpg,0.757764,0.151248,0.0848401999999999,Malamute,2355,8467
510,784431430411685888,This is Stormy. He's curly af. Already pupared for Coachella next year. 12/10 https://t.co/PHA1vtqqpt,12,10,Stormy,2016-10-07,16:33:21,,https://pbs.twimg.com/media/CuLcNkCXgAEIwK2.jpg,0.744819,0.243192,0.0109202,Miniature_poodle,1180,5430
511,783839966405230592,This is Riley. His owner put a donut pillow around him and he loves it so much he won't let anyone take it off. 13/10 https://t.co/8TCQcsZCZ8,13,10,Riley,2016-10-06,01:23:05,,https://pbs.twimg.com/media/CuDCSM-XEAAJw1W.jpg,0.333739,0.136245,0.117464,,9997,28293
512,783821107061198850,This is Mairi. She has mastered the art of camouflage. 12/10 h*ckin sneaky af https://t.co/STcPjiNAHp,12,10,Mairi,2016-10-06,00:08:09,,https://pbs.twimg.com/media/CuCxIzyWEAQTnQA.jpg,0.265659,0.196414,0.1335339999999999,Lakeland_terrier,1819,6952
513,783695101801398276,This is Loomis. He's the leader of the Kenneth search party. The passion is almost overwhelming. 12/10 one day he will be free https://t.co/kCRKlFg4AY,12,10,Loomis,2016-10-05,15:47:27,,https://pbs.twimg.com/media/CuA-iRHXYAAWP8e.jpg,0.314265,0.300435,0.0494869,Chow,2980,9833
514,783466772167098368,This is Finn. He likes eavesdropping from filing cabinets. It's a real issue but no one has approached him about it. 11/10 would still pet https://t.co/s8W8Del9HQ,11,10,Finn,2016-10-05,00:40:09,,https://pbs.twimg.com/media/Ct9u3ljW8AEnVIm.jpg,0.789,0.115916,0.0362939,Chihuahua,2071,7940
515,783391753726550016,Meet Godi. He's an avid beachgoer and part time rainbow summoner. Eyeliner flawless af. 13/10 would snug well https://t.co/BO936YdJdi,13,10,Godi,2016-10-04,19:42:03,,https://pbs.twimg.com/media/Ct8qn8EWIAAk9zP.jpg,0.87713,0.0862406,0.0110191,Norwegian_elkhound,5070,15947
