,tweet_id,text,rating_numerator,rating_denominator,name,date,time,dog_type,jpg_url,p1_conf,p2_conf,p3_conf,dog_breed,retweet_count,favorite_count
1430,676975532580409345,This is Cooper. He doesn't know how cheese works. Likes the way it feels on his face. Cheeky tongue slip. 11/10 https://t.co/j1zczS0lI5,11,10,Cooper,2015-12-16,04:01:59,,https://pbs.twimg.com/media/CWUZpydWcAAeipD.jpg,0.363257,0.245862,0.125547,Malamute,949,2523
1431,676949632774234114,This is Tyrus. He's a Speckled Centennial Ticonderoga. Terrified of floating red ball. Nifty bandana. 8/10 v petable https://t.co/HqM3YhCaaa,8,10,Tyrus,2015-12-16,02:19:04,,https://pbs.twimg.com/media/CWUCGMtWEAAjXnS.jpg,0.206479,0.139339,0.114606,Welsh_springer_spaniel,348,1180
1432,676948236477857792,This is Karl. Karl thinks he's slick. 6/10 sneaky pup https://t.co/Lo4ALwjVh4,6,10,Karl,2015-12-16,02:13:31,,https://pbs.twimg.com/media/CWUA1GFW4AAowiq.jpg,0.611603,0.135176,0.0832473,,771,1952
1433,676946864479084545,This pups goal was to get all four feet as close to each other as possible. Valiant effort 12/10 https://t.co/2mXALbgBTV,12,10,None,2015-12-16,02:08:04,,https://pbs.twimg.com/media/CWT_lOQWUAAXPaY.jpg,0.752707,0.0556545999999999,0.0410178,Pekinese,326,1574
1434,676942428000112642,Who leaves the last cupcake just sitting there? 9/10 https://t.co/PWMqAoEx2a,9,10,None,2015-12-16,01:50:26,,https://pbs.twimg.com/media/CWT7imQXIAMwpQ2.jpg,0.707199,0.15463,0.0976255,,665,1868
1435,676936541936185344,Here we see a rare pouched pupper. Ample storage space. Looks alert. Jumps at random. Kicked open that door. 8/10 https://t.co/mqvaxleHRz,8,10,None,2015-12-16,01:27:03,pupper,https://pbs.twimg.com/media/CWT2MUgWIAECWig.jpg,0.5452859999999999,0.081482,0.0473911,Chesapeake_bay_retriever,4416,11590
1436,676897532954456065,Exotic handheld dog here. Appears unathletic. Feet look deadly. Can be thrown a great distance. 5/10 might pet idk https://t.co/Avq4awulqk,5,10,None,2015-12-15,22:52:02,,https://pbs.twimg.com/media/CWTSt0UW4AALMNB.jpg,0.628255,0.318646,0.0130581999999999,,647,2050
1437,676864501615042560,Meet Ash. He's just a head now. Lost his body during the Third Crusade. Still in good spirits. 10/10 would pet well https://t.co/NJj2uP0atK,10,10,Ash,2015-12-15,20:40:47,,https://pbs.twimg.com/media/CWS0q8iU8AE2Srr.jpg,0.371146,0.0995963,0.0489679,Chesapeake_bay_retriever,623,1883
1438,676821958043033607,Finally some constructive political change in this country. 11/10 https://t.co/mvQaETHVSb,11,10,None,2015-12-15,17:51:44,,https://pbs.twimg.com/media/CWSN-vaXAAA8Ehr.jpg,0.8698040000000001,0.0798143,0.0132629999999999,Great_pyrenees,13725,20649
1439,676819651066732545,Watch out Airbud. This pupper is also good at the sports. 12/10 I'm thinking D1 https://t.co/1HrFdo7M0C,12,10,None,2015-12-15,17:42:34,pupper,https://pbs.twimg.com/media/CWSL4W8WsAAE4KU.jpg,0.625555,0.138383,0.0394645999999999,Labrador_retriever,599,1652
1440,676811746707918848,Say hello to Penny &amp; Gizmo. They are practicing their caroling. The ambition in the room is tangible. 9/10 for both https://t.co/aqBHjjh5VD,9,10,Penny,2015-12-15,17:11:09,,https://pbs.twimg.com/media/CWSEsO9WwAAX-fZ.jpg,0.440916,0.345806,0.0603312,Chihuahua,379,1302
1441,676776431406465024,"When someone yells ""cops!"" at a party and you gotta get your drunk friend out of there. 10/10 https://t.co/4rMZi5Ca1k",10,10,None,2015-12-15,14:50:49,,https://pbs.twimg.com/ext_tw_video_thumb/676776408941662209/pu/img/k-6I3YEZAQtYPBXR.jpg,0.201346,0.191749,0.03811,,1796,4503
1442,676617503762681856,I promise this wasn't meant to be a cuteness overload account but ermergerd look at this cozy pupper. 13/10 https://t.co/mpQl2rJjDh,13,10,None,2015-12-15,04:19:18,pupper,https://pbs.twimg.com/media/CWPUB9TWwAALPPx.jpg,0.841084,0.12053,0.00660034,Chihuahua,854,2611
1443,676613908052996102,This is the saddest/sweetest/best picture I've been sent. 12/10 ðŸ˜¢ðŸ¶ https://t.co/vQ2Lw1BLBF,12,10,the,2015-12-15,04:05:01,,https://pbs.twimg.com/media/CWPQwmJWUAAu_At.jpg,0.4937899999999999,0.0964228,0.0706466999999999,Doberman,176,984
1444,676606785097199616,*screeches for a sec and then faints* 12/10 https://t.co/N5QL4ySBEx,12,10,None,2015-12-15,03:36:42,,https://pbs.twimg.com/media/CWPKSGpWcAQN6mw.jpg,0.202999,0.2004109999999999,0.1423,Malinois,386,1721
1445,676603393314578432,This is Godzilla pupper. He had a ruff childhood &amp; now deflects that pain outward by terrorizing cities. Tragic 9/10 https://t.co/g1tLGkyaxr,9,10,Godzilla,2015-12-15,03:23:14,pupper,https://pbs.twimg.com/media/CWPHMqKVAAAE78E.jpg,0.8770209999999999,0.0341819,0.028404,Whippet,339,1037
1446,676588346097852417,This is Bubbles. He kinda resembles a fish. Always makes eye contact with u no matter what. Sneaky tongue slip. 5/10 https://t.co/Nrhvc5tLFT,5,10,Bubbles,2015-12-15,02:23:26,,https://pbs.twimg.com/media/CWO5gmCUYAAX4WA.jpg,0.976577,0.0143237,0.00230192,Boston_bull,696,2076
1447,676582956622721024,"Meet Vinnie. He's having fun while being safe. Well not a lot of fun, but definitely safe, and that's important 8/10 https://t.co/vZYtynZZlH",8,10,Vinnie,2015-12-15,02:02:01,,https://pbs.twimg.com/media/CWO0m8tUwAAB901.jpg,0.790028,0.1963069999999999,0.0124289,Boston_bull,251,1073
1448,676575501977128964,This pupper is very passionate about Christmas. Wanted to give the tree a hug. So cute. 8/10 https://t.co/NsGyECJuq7,8,10,None,2015-12-15,01:32:24,pupper,https://pbs.twimg.com/media/CWOt07EUsAAnOYW.jpg,0.424106,0.0731443,0.0575976,Yorkshire_terrier,985,2322
1449,676533798876651520,ITSOFLUFFAYYYYY 12/10 https://t.co/bfw13CnuuZ,12,10,None,2015-12-14,22:46:41,,https://pbs.twimg.com/media/CWOH4s9U8AEtkmQ.jpg,0.2652739999999999,0.167614,0.117506,Chow,487,1695
1450,676496375194980353,Say hello to Griffin. He's upset because his costume for Halloween didn't arrive until today. 9/10 cheer up pup https://t.co/eoBCjSFajX,9,10,Griffin,2015-12-14,20:17:59,,https://pbs.twimg.com/media/CWNl3S9WcAARN34.jpg,0.985387,0.0044169,0.00389287,Pug,471,1372
1451,676470639084101634,Three generations of pupper. 11/10 for all https://t.co/tAmQYvzrau,11,10,None,2015-12-14,18:35:43,pupper,https://pbs.twimg.com/media/CWNOdIpWoAAWid2.jpg,0.7903859999999999,0.0228851,0.0153434,Golden_retriever,4165,10548
1452,676440007570247681,Hope your Monday isn't too awful. Here's two baseball puppers. 11/10 for each https://t.co/dB0H9hdZai,11,10,None,2015-12-14,16:34:00,pupper,https://pbs.twimg.com/media/CWMyl9EWUAAnZJ0.jpg,0.579472,0.133446,0.0943966,Maltese_dog,587,1559
1453,676430933382295552,"Meet Duke. He's an Urban Parmesan. They know he's scared of the green rubber dog. ""Why u do dis?"" thinks Duke. 10/10 https://t.co/3bim9U5Idr",10,10,Duke,2015-12-14,15:57:56,,https://pbs.twimg.com/media/CWMqV7WUYAEEClG.jpg,0.583875,0.203671,0.0361217,Golden_retriever,302,1261
1454,676263575653122048,All this pupper wanted to do was go skiing. No one told him about the El NiÃ±o. Poor pupper. 10/10 maybe next year https://t.co/fTgbq1UBR9,10,10,None,2015-12-14,04:52:55,pupper,https://pbs.twimg.com/media/CWKSIfUUYAAiOBO.jpg,0.0982826,0.0980293,0.0778521,Toy_poodle,483,1889
1455,676237365392908289,Say hello to Winston. He has no respect for the system. Much rebellion. I think that's a palm tree... nice. 8/10 https://t.co/dOLQddhXLZ,8,10,Winston,2015-12-14,03:08:46,,https://pbs.twimg.com/media/CWJ6Sc-WwAAlpI6.jpg,0.961996,0.021793,0.00691629,French_bulldog,249,1089
1456,676219687039057920,This is Kenneth. He's stuck in a bubble. 10/10 hang in there Kenneth https://t.co/uQt37xlYMJ,10,10,Kenneth,2015-12-14,01:58:31,,https://pbs.twimg.com/media/CWJqN9iWwAAg86R.jpg,0.997556,0.000158961,0.000132464,Whippet,27646,70661
1457,676215927814406144,This is Herm. He just wants to be like the other dogs. Sneaky tongue slip. Super fuzzy. 9/10 would cuddle firmly https://t.co/tg8h9lzCHv,9,10,Herm,2015-12-14,01:43:35,,https://pbs.twimg.com/media/CWJmzNsWUAE706Z.jpg,0.999484,0.000158217,6.091100000000001e-05,,516,1569
1458,676191832485810177,These two pups just met and have instantly bonded. Spectacular scene. Mesmerizing af. 10/10 and 7/10 for blue dog https://t.co/gwryaJO4tC,10,10,None,2015-12-14,00:07:50,,https://pbs.twimg.com/media/CWJQ4UmWoAIJ29t.jpg,0.376741,0.173114,0.0714851,Chihuahua,915,2050
1459,676146341966438401,This is Bert. He likes flowers. 10/10 https://t.co/lmQRrNxaQu,10,10,Bert,2015-12-13,21:07:04,,https://pbs.twimg.com/media/CWIngp5WEAAJOy3.jpg,0.388332,0.284121,0.0348681,Irish_water_spaniel,585,1747
1460,676101918813499392,Meet Striker. He's ready for Christmas. 11/10 https://t.co/B3xxSLjQSH,11,10,Striker,2015-12-13,18:10:33,,https://pbs.twimg.com/media/CWH_FTgWIAAwOUy.jpg,0.225848,0.186873,0.1069869999999999,Shih-tzu,1047,2578
1461,676098748976615425,Extremely rare pup here. Very religious. Always praying. Too many legs. Not overwhelmingly fluffy. Won't bark. 3/10 https://t.co/REyE5YKVBb,3,10,None,2015-12-13,17:57:57,,https://pbs.twimg.com/media/CWH8L72UkAAvjql.jpg,0.162179,0.1290859999999999,0.0814119,,1246,2669
1462,676089483918516224,"""Yes hello I'ma just snag this here toasted bagel real quick. carry on."" 9/10 https://t.co/Cuz0Osnekp",9,10,None,2015-12-13,17:21:08,,https://pbs.twimg.com/media/CWHzzFGXIAA0Y_H.jpg,0.743808,0.106697,0.0423353,Bull_mastiff,389,1177
1463,675898130735476737,I'm sure you've all seen this pupper. Not prepared at all for the flying disc of terror. 10/10 https://t.co/G0pQiFGM7O,10,10,None,2015-12-13,04:40:46,pupper,https://pbs.twimg.com/media/CWFFt3_XIAArIYK.jpg,0.40743,0.0770367,0.0745973,Labrador_retriever,506,1441
1464,675891555769696257,This is Donny. He's summoning the demon monster Babadook. 6/10 Donny please no that won't be a good time for anyone https://t.co/kiW6Knb7Gp,6,10,Donny,2015-12-13,04:14:39,,https://pbs.twimg.com/media/CWE_x33UwAEE3no.jpg,0.305637,0.232057,0.117806,Italian_greyhound,761,1918
1465,675888385639251968,Breathtaking scene. A father taking care of his newborn pup. Tugs at the heartstrings. 10/10 restores my faith https://t.co/06oZdehGEa,10,10,None,2015-12-13,04:02:03,,https://pbs.twimg.com/media/CWE85snWIAEG5ES.jpg,0.672117,0.146147,0.0231414,West_highland_white_terrier,839,2113
1466,675878199931371520,"Ok, I'll admit this is a pretty adorable bunny hopping towards the ocean but please only send in dogs... 11/10 https://t.co/sfsVCGIipI",11,10,None,2015-12-13,03:21:34,,https://pbs.twimg.com/media/CWEzo19WoAEiOCj.jpg,0.785756,0.118181,0.0436270999999999,Cardigan,1237,3777
1467,675870721063669760,&amp; this is Yoshi. Another world record contender 11/10 (what the hell is happening why are there so many contenders?) https://t.co/QG708dDNH6,11,10,None,2015-12-13,02:51:51,,https://pbs.twimg.com/media/CWEs1b-WEAEhq82.jpg,0.263892,0.184193,0.182241,Golden_retriever,496,1464
1468,675845657354215424,"This is Pepper. She's not fully comfortable riding her imaginary bike yet. 10/10 don't worry pupper, it gets easier https://t.co/40dj4eTsXG",10,10,Pepper,2015-12-13,01:12:15,pupper,https://pbs.twimg.com/media/CWEWClfW4AAnqhG.jpg,0.8839520000000001,0.0110568,0.00983981,Pug,775,2044
1469,675822767435051008,ðŸŽ¶ HELLO FROM THE OTHER SIIIIIIIIDE ðŸŽ¶ 10/10s https://t.co/GK2HJtkdQk,10,10,None,2015-12-12,23:41:18,,https://pbs.twimg.com/media/CWEBOFYWwAA-O2c.jpg,0.46071,0.202765,0.133266,Pomeranian,474,1385
1470,675820929667219457,Here's a handful of sleepy puppers. All look unaware of their surroundings. Lousy guard dogs. Still cute tho 11/10s https://t.co/lyXX3v5j4s,11,10,None,2015-12-12,23:34:00,pupper,https://pbs.twimg.com/media/CWD_jQMWEAAdYwH.jpg,0.556373,0.201675,0.110848,Basset,206,954
1471,675798442703122432,This is Bernie. He just touched a boob for the first time. 10/10 https://t.co/whQKMygnK6,10,10,Bernie,2015-12-12,22:04:39,,https://pbs.twimg.com/media/CWDrGH4UYAARoq_.jpg,0.681218,0.125121,0.0803982,Beagle,3041,9298
1472,675781562965868544,Say hello to Buddah. He was Waldo for Halloween. 11/10 https://t.co/DVAqAnb624,11,10,Buddah,2015-12-12,20:57:34,,https://pbs.twimg.com/media/CWDbv2yU4AARfeH.jpg,0.921968,0.0178107,0.0135554,Maltese_dog,418,1451
1473,675740360753160193,Here's a pupper licking in slow motion. 12/10 please enjoy https://t.co/AUJi8ujxw9,12,10,None,2015-12-12,18:13:51,pupper,https://pbs.twimg.com/ext_tw_video_thumb/675740268751138818/pu/img/dVaVeFAVT-lk_1ZV.jpg,0.800495,0.0977564,0.0684146,Golden_retriever,295,1056
1474,675710890956750848,This is Lenny. He was just told that he couldn't explore the fish tank. 12/10 smh all that work for nothing https://t.co/JWi6YrpiO1,12,10,Lenny,2015-12-12,16:16:45,,https://pbs.twimg.com/media/CWCbd8ZWoAAtqoH.jpg,0.441427,0.248885,0.164967,Standard_schnauzer,717,1681
1475,675707330206547968,We've got ourselves a battle here. Watch out Reggie. 11/10 https://t.co/ALJvbtcwf0,11,10,None,2015-12-12,16:02:36,,https://pbs.twimg.com/media/CWCYOqWUAAARmGr.jpg,0.721933,0.0593442,0.0357015999999999,Staffordshire_bullterrier,596,1783
1476,675706639471788032,This is a Sizzlin Menorah spaniel from Brooklyn named Wylie. Lovable eyes. Chiller as hell. 10/10 and I'm out.. poof https://t.co/7E0AiJXPmI,10,10,a,2015-12-12,15:59:51,,https://pbs.twimg.com/media/CWCXj35VEAIFvtk.jpg,0.9903,0.00207991,0.00201378,English_springer,85,582
1477,675534494439489536,Seriously guys?! Only send in dogs. I only rate dogs. This is a baby black bear... 11/10 https://t.co/H7kpabTfLj,11,10,a,2015-12-12,04:35:48,,https://pbs.twimg.com/media/CV_7CV6XIAEV05u.jpg,0.749368,0.133738,0.0499138,Chow,361,1661
1478,675531475945709568,This is Ellie AKA Queen Slayer of the Orbs. Very self-motivated. Great yard. Rad foliage. 10/10 would pet diligently https://t.co/c9jmg3Xtzn,10,10,Ellie,2015-12-12,04:23:49,,https://pbs.twimg.com/media/CV_4ShmUYAA3wNu.jpg,0.918441,0.0273395,0.020221,Pembroke,329,1067
1479,675522403582218240,Meet Sammy. He's a Motorola Firefox. Hat under hoodie (must be a half-decent up and coming white rapper) 10/10 https://t.co/rO2zxf0OQ0,10,10,Sammy,2015-12-12,03:47:46,,https://pbs.twimg.com/media/CV_wCh8W4AEWWZ9.jpg,0.299708,0.263665,0.0803233,Cocker_spaniel,249,936
1480,675517828909424640,12/10 stay woke https://t.co/XDiQw4Akiw,12,10,None,2015-12-12,03:29:35,,https://pbs.twimg.com/media/CV_r3v4VAAALvwg.jpg,0.240591,0.156916,0.0908993999999999,Scottish_deerhound,407,1147
1481,675501075957489664,"I shall call him squishy and he shall be mine, and he shall be my squishy. 13/10 https://t.co/WId5lxNdPH",13,10,None,2015-12-12,02:23:01,,https://pbs.twimg.com/media/CV_cnjHWUAADc-c.jpg,0.806757,0.0279065999999999,0.0181889,,5202,15513
1482,675497103322386432,Meet Reggie. He's going for the world record. Must concentrate. Focus up pup. 11/10 we all believe in you Reggie https://t.co/h3AWz4AzuC,11,10,Reggie,2015-12-12,02:07:14,,https://pbs.twimg.com/media/CV_ZAhcUkAUeKtZ.jpg,0.5195890000000001,0.0647712,0.0614913,Vizsla,1130,2814
1483,675489971617296384,RT until we find this dog. Clearly a cool dog (front leg relaxed out window). Looks to be a superb driver. 10/10 https://t.co/MnTrKaQ8Wn,10,10,None,2015-12-12,01:38:53,,https://pbs.twimg.com/media/CV_SimUWoAAvJSY.jpg,0.139613,0.118647,0.0939522,West_highland_white_terrier,526,1148
1484,675483430902214656,Rare shielded battle dog here. Very happy about abundance of lettuce. Painfully slow fetcher. Still petable. 5/10 https://t.co/C3tlKVq7eO,5,10,None,2015-12-12,01:12:54,,https://pbs.twimg.com/media/CV_MmGZU8AAggM6.jpg,0.543706,0.2026,0.0711215,,853,1658
1485,675432746517426176,Happy Friday. Here's some golden puppers. 12/10 for all https://t.co/wNkqAED6lG,12,10,None,2015-12-11,21:51:30,pupper,https://pbs.twimg.com/media/CV-ef64WoAAbh0I.jpg,0.986548,0.00886185,0.000693528,Labrador_retriever,501,1358
1486,675372240448454658,"The tail alone is 13/10. Great dog, better owner https://t.co/IyAXinfyju",13,10,None,2015-12-11,17:51:04,,https://pbs.twimg.com/media/CV9nd30XAAAEba5.jpg,0.416385,0.102933,0.0872995,Chihuahua,452,1524
1487,675362609739206656,This is Daisy. She loves that shoe. Still no seat belt. Super churlish. 12/10 the dogs are killing it today https://t.co/cZlkvgRPdn,12,10,Daisy,2015-12-11,17:12:48,,https://pbs.twimg.com/media/CV9etctWUAAl5Hp.jpg,0.479008,0.2182889999999999,0.1399109999999999,Labrador_retriever,192,941
1488,675354435921575936,Everyone needs to watch this. 13/10 https://t.co/Bb3xnpsWBC,13,10,None,2015-12-11,16:40:19,,https://pbs.twimg.com/ext_tw_video_thumb/675354114423808004/pu/img/qL1R_nGLqa6lmkOx.jpg,0.303415,0.181351,0.1620839999999999,Golden_retriever,14855,29382
1489,675349384339542016,Yea I lied. Here's more. All 13/10 https://t.co/ZQZf2U4xCP,13,10,None,2015-12-11,16:20:15,,https://pbs.twimg.com/media/CV9SrABU4AQI46z.jpg,0.866367,0.122079,0.00401972,Borzoi,1996,3522
1490,675334060156301312,Good morning here's a grass pupper. 12/10 https://t.co/2d68FmWGGs,12,10,None,2015-12-11,15:19:21,pupper,https://pbs.twimg.com/media/CV9EvZNUwAAgLCK.jpg,0.773135,0.11681,0.0390362,Pembroke,1127,2482
1491,675166823650848770,This is Arnold. He broke his leg saving a handicapped child from a forest fire. True hero. 10/10 inspirational dog https://t.co/bijCeHeX4C,10,10,Arnold,2015-12-11,04:14:49,,https://pbs.twimg.com/media/CV6spB7XAAIpMyP.jpg,0.284394,0.132569,0.127975,Standard_poodle,1382,3163
1492,675153376133427200,What kind of person sends in a picture without a dog in it? 1/10 just because that's a nice table https://t.co/RDXCfk8hK0,1,10,None,2015-12-11,03:21:23,,https://pbs.twimg.com/media/CV6gaUUWEAAnETq.jpg,0.327957,0.0960268999999999,0.0349950999999999,,2256,5578
1493,675149409102012420,holy shit 12/10 https://t.co/p6O8X93bTQ,12,10,None,2015-12-11,03:05:37,,https://pbs.twimg.com/media/CV6czeEWEAEdChp.jpg,0.999876,5.86749e-05,2.87785e-05,Chow,1496,3345
1494,675147105808306176,When you're presenting a group project and the 4th guy tells the teacher that he did all the work. 10/10 https://t.co/f50mbB4UWS,10,10,None,2015-12-11,02:56:28,,https://pbs.twimg.com/media/CV6atgoWcAEsdv6.jpg,0.949215,0.0167654,0.0106372999999999,Golden_retriever,197,841
1495,675146535592706048,This is Coops. He's yelling at the carpet. Not very productive Coops. 7/10 https://t.co/Uz52oYnHzF,7,10,Coops,2015-12-11,02:54:12,,https://pbs.twimg.com/media/CV6aMToXIAA7kH4.jpg,0.2884469999999999,0.229944,0.190407,Cardigan,255,1052
1496,675145476954566656,What an honor. 3 dogs here. Blond one is clearly a gymnast. Other two just confused. Very nifty pups. 9/10 for all https://t.co/YDgstgIDGs,9,10,None,2015-12-11,02:49:59,,https://pbs.twimg.com/media/CV6ZOPqWsAA20Uj.jpg,0.458746,0.235504,0.116864,Labrador_retriever,779,1911
1497,675135153782571009,This is Steven. He got locked outside. Damn it Steven. 5/10 nice grill tho https://t.co/zf7Sxxjfp3,5,10,Steven,2015-12-11,02:08:58,,https://pbs.twimg.com/media/CV6P1lnWIAAUQHk.jpg,0.587507,0.0517131,0.0207253,,411,1162
1498,675113801096802304,Meet Zuzu. He just graduated college. Astute pupper. Needs 2 leashes to contain him. Wasn't ready for the pic. 10/10 https://t.co/2H5SKmk0k7,10,10,Zuzu,2015-12-11,00:44:07,pupper,https://pbs.twimg.com/media/CV58a4nXAAApywo.jpg,0.16802,0.1088069999999999,0.0433118,,686,1732
1499,675111688094527488,Say hello to Oliver. He thought what was inside the pillow should be outside the pillow. Blurry since birth. 8/10 https://t.co/lFU9W31Fg9,8,10,Oliver,2015-12-11,00:35:44,,https://pbs.twimg.com/media/CV56f54WsAEv4kJ.jpg,0.631501,0.101927,0.0626498,Labrador_retriever,213,867
1500,675109292475830276,C'mon guys. We've been over this. We only rate dogs. This is a cow. Please only submit dogs. Thank you...... 9/10 https://t.co/WjcELNEqN2,9,10,a,2015-12-11,00:26:12,,https://pbs.twimg.com/media/CV54UQTXAAAGf-j.jpg,0.989519,0.00525767,0.00144283,Dalmatian,995,2515
1501,675047298674663426,This is a fluffy albino Bacardi Columbia mix. Excellent at the tweets. 11/10 would hug gently https://t.co/diboDRUuEI,11,10,a,2015-12-10,20:19:52,,https://pbs.twimg.com/media/CV4_8FgXAAQOj4S.jpg,0.978007,0.00712124,0.00639783,Samoyed,274,926
1502,675015141583413248,Meet Moe. He's a golden Fetty Woof. Doesn't respect the authorities. Might own a motorhome? 10/10 revolutionary pup https://t.co/JAncIdNp8G,10,10,Moe,2015-12-10,18:12:05,,https://pbs.twimg.com/media/CV4iqh5WcAEV1E6.jpg,0.290091,0.258372,0.132173,Golden_retriever,1034,2403
1503,675006312288268288,Say hello to Mollie. This pic was taken after she bet all her toys on Ronda Rousey. 10/10 hang in there pupper https://t.co/QMmAqA9VqO,10,10,Mollie,2015-12-10,17:37:00,pupper,https://pbs.twimg.com/media/CV4aqCwWsAIi3OP.jpg,0.654697,0.0433888,0.0428476,Boxer,200,873
1504,675003128568291329,Meet Laela. She's adorable. Magnificent eyes. But I don't see a seat belt. Insubordinate.. and churlish. Still 12/10 https://t.co/pCGDgLkLo6,12,10,Laela,2015-12-10,17:24:21,,https://pbs.twimg.com/media/CV4XwYiWoAAHQIF.jpg,0.655279,0.104164,0.0528177,Pembroke,406,1388
1505,674999807681908736,Ok last one of these. I may try to make some myself. Anyway here ya go. 13/10 https://t.co/i9CDd1oEu8,13,10,None,2015-12-10,17:11:09,,https://pbs.twimg.com/media/CV4UvgNUkAEEnZd.jpg,0.591829,0.204544,0.0786018999999999,Rottweiler,951,1989
1506,674805413498527744,"When your entire life is crumbling before you and you're trying really hard to hold your shit together.
10/10 https://t.co/vqFkgYPCW8",10,10,None,2015-12-10,04:18:42,,https://pbs.twimg.com/ext_tw_video_thumb/674805331965399040/pu/img/-7bw8niVrgIkLKOW.jpg,0.594467,0.389994,0.00709611,English_springer,315,759
1507,674800520222154752,This is Tedders. He broke his leg saving babies from the Pompeii eruption. 11/10 where's his Purple Heart? @POTUS https://t.co/cMI2AcLm4B,11,10,Tedders,2015-12-10,03:59:15,,https://pbs.twimg.com/media/CV1ffl3XAAAiFyr.jpg,0.8764790000000001,0.0969114,0.00919567,Pembroke,746,2688
1508,674793399141146624,I have found another. 13/10 https://t.co/HwroPYv8pY,13,10,None,2015-12-10,03:30:58,,https://pbs.twimg.com/media/CV1ZA3oWEAA1HW_.jpg,0.119693,0.0727627,0.0637859,Giant_schnauzer,950,2216
1509,674790488185167872,ER... MER... GERD 13/10 https://t.co/L1puJISV1a,13,10,None,2015-12-10,03:19:24,,https://pbs.twimg.com/media/CV1WXsmWcAAgQ56.jpg,0.8019029999999999,0.193575,0.00119305,Labrador_retriever,216,982
1510,674788554665512960,Say hello to Maggie. She's a Western Septic Downy. Pretends to be Mexican. Great hardwood flooring. 9/10 https://t.co/P3ElQ2wsjb,9,10,Maggie,2015-12-10,03:11:43,,https://pbs.twimg.com/media/CV1Um8vWIAAmhQn.jpg,0.349561,0.154711,0.134229,Miniature_poodle,181,718
1511,674781762103414784,Bedazzled pup here. Fashionable af. Super yellow. Looks hella fluffy. Webbed paws for efficient fetching. 8/10 https://t.co/ot8yMUGodj,8,10,None,2015-12-10,02:44:43,,https://pbs.twimg.com/media/CV1ObvEWcAA7c6i.jpg,0.148975,0.0689848999999999,0.0317285,,1043,1803
1512,674774481756377088,This is Superpup. His head isn't proportional to his body. Has yet to serve any justice. 11/10 maybe one day pupper https://t.co/gxIFgg8ktm,11,10,Superpup,2015-12-10,02:15:47,pupper,https://pbs.twimg.com/media/CV1HztsWoAAuZwo.jpg,0.407016,0.309978,0.227677,Chihuahua,407,979
1513,674767892831932416,This pup was carefully tossed to make it look like she's riding that horse. I have no words this is fabulous. 12/10 https://t.co/Bob33W4sfD,12,10,None,2015-12-10,01:49:36,,https://pbs.twimg.com/media/CV1B0WkWwAEBKVx.jpg,0.238855,0.0924141,0.0564125,,689,1624
1514,674764817387900928,These two pups are masters of camouflage. Very dedicated to the craft. Both must've spent decades practicing. 10/10s https://t.co/RBiQ8hPqwr,10,10,None,2015-12-10,01:37:23,,https://pbs.twimg.com/media/CV0_BSuWIAIvE9k.jpg,0.634695,0.309853,0.019641,Samoyed,200,698
1515,674754018082705410,Just received another perfect photo of dogs and the sunset. 12/10 https://t.co/9YmNcxA2Cc,12,10,None,2015-12-10,00:54:28,,https://pbs.twimg.com/media/CV01M3ZWIAAV7rv.jpg,0.352321,0.131753,0.0955966999999999,,382,1228
1516,674752233200820224,Everyone please just appreciate how perfect these two photos are. 12/10 for both https://t.co/rLf7asnHxO,12,10,None,2015-12-10,00:47:23,,https://pbs.twimg.com/media/CV0zkzEU4AAzLc5.jpg,0.665516,0.173366,0.134783,Vizsla,399,1307
1517,674743008475090944,This is Sophie. She just saw a spider. 10/10 don't just stand there Sophie https://t.co/VagYftZccT,10,10,Sophie,2015-12-10,00:10:43,,https://pbs.twimg.com/media/CV0rL7RWEAAbhqm.jpg,0.583054,0.0659904,0.0652362,Bernese_mountain_dog,464,1258
1518,674739953134403584,"""ðŸŽ¶ DO YOU BELIEVE IN LIFE AFTER LOVE ðŸŽ¶""
11/10 https://t.co/URNs5zFskc",11,10,None,2015-12-09,23:58:35,,https://pbs.twimg.com/media/CV0oaHFW4AA9Coi.jpg,0.175915,0.0965343,0.0641447,Dandie_dinmont,326,968
1519,674737130913071104,Meet Rufio. He is unaware of the pink legless pupper wrapped around him. Might want to get that checked 10/10 &amp; 4/10 https://t.co/KNfLnYPmYh,10,10,Rufio,2015-12-09,23:47:22,pupper,https://pbs.twimg.com/media/CV0l10AU8AAfg-a.jpg,0.948537,0.0143098999999999,0.00812024,Pomeranian,80,580
1520,674690135443775488,Meet Patrick. He's an exotic pup. Jumps great distances for a dog. Always gets injured when I toss him a ball. 3/10 https://t.co/Unz1uNrOzo,3,10,Patrick,2015-12-09,20:40:38,,https://pbs.twimg.com/media/CVz7FxXWUAAlTRP.jpg,0.242538,0.212589,0.172838,,411,1022
1521,674670581682434048,Meet Jeb &amp; Bush. Jeb is somehow stuck in that fence and Bush won't stop whispering sweet nothings in his ear. 9/10s https://t.co/NRNExUy9Hm,9,10,Jeb,2015-12-09,19:22:56,,https://pbs.twimg.com/media/CVzpUGUWUAAo7Vn.jpg,0.180079,0.178033,0.0779661,Malamute,565,1444
1522,674664755118911488,This is Rodman. He's getting destroyed by the surfs. Valiant effort though. 10/10 better than most puppers probably https://t.co/S8wCLemrNb,10,10,Rodman,2015-12-09,18:59:46,pupper,https://pbs.twimg.com/media/CVzkA7-WsAAcXz6.jpg,0.330625,0.0753557,0.0574807,,205,807
